{
  "report_version": "verification-report-1.0",
  "report_id": "99999999-2222-4333-8444-555555555555",
  "db_id": "kafel-dev-mysql",
  "verifier": {
    "type": "independent_external"
  },
  "scope": {
    "first_segment_sequence": 0,
    "last_segment_sequence": 1
  },
  "generated_at": "2026-06-04T00:00:00.000Z",
  "overall_result": "PASS",
  "checks": [
    {
      "check": "per_object_hash",
      "result": "PASS"
    },
    {
      "check": "object_chain",
      "result": "PASS"
    },
    {
      "check": "segment_manifest",
      "result": "PASS"
    },
    {
      "check": "cross_segment_continuity",
      "result": "PASS"
    },
    {
      "check": "no_missing_segment",
      "result": "PASS"
    },
    {
      "check": "no_missing_event",
      "result": "PASS"
    },
    {
      "check": "hsm_signature",
      "result": "PASS"
    },
    {
      "check": "anchor_token",
      "result": "PASS",
      "details": "seg-reval-mpz6i8pl-000000: rfc3161 gen_time=2026-06-04T07:33:33.753Z | seg-reval-mpz6i8pl-000001: rfc3161 gen_time=2026-06-04T07:33:33.765Z"
    },
    {
      "check": "projection_consistency",
      "result": "SKIPPED",
      "details": "not yet implemented in this verifier stage"
    }
  ],
  "report_signature": null
}
